Dauphin	Williams Valley	N	N	Williams Valley School District																											
Delaware	Chester Community Cs	N	N	Chester Community Cs																											
Delaware	Chester Cs For The Arts	N	N	Chester Cs For The Arts School District																											
Delaware	Chester-Upland	Y	Y	Chester-Upland School District																											
Delaware	Chichester	N	Y	Chichester School District																											
Delaware	Delaware County Technical High School	N	N	Delaware County Technical High School																											
Delaware	Garnet Valley	N	N	Garnet Valley School District																											
Delaware	Haverford Township	N	N	Haverford Township School District																											
Delaware	Interboro	N	N	Interboro School District																											
Delaware	Marple Newtown	N	N	Marple Newtown School District																											
Delaware	Penn-Delco	N	N	Penn-Delco School District																											
Delaware	Radnor Township	N	N	Radnor Township School District																											
Delaware	Ridley	N	N	Ridley School District																											
Delaware	Rose Tree Media	N	N	Rose Tree Media School District																											
Delaware	Southeast Delco	Y	Y	Southeast Delco School District																											
Delaware	Springfield	N	N	Springfield School District																											
Delaware	Upper Darby	Y	Y	Upper Darby School District																											
Delaware	Vision Academy Charter School	N	N	Vision Academy Charter School																											
Delaware	Wallingford-Swarthmore	N	N	Wallingford-Swarthmore School District																											
Delaware	Widener Partnership Cs	N	N	Widener Partnership Cs																											
Delaware	William Penn	Y	Y	William Penn School District																											
Elk	Johnsonburg Area	N	N	Johnsonburg Area School District																											
Elk	Ridgway Area	N	N	Ridgway Area School District																											
Elk	Saint Marys Area	N	N	Saint Marys Area School District																											
Erie	Corry Area	Y	N	Corry Area School District																											
Erie	Erie City	Y	Y	Erie City School District																											
Erie	Erie County Technical School	N	N	Erie County Technical School																											
Erie	Erie Rise Leadership Academy Charter School	N	N	Erie Rise Leadership Academy Charter School																											
Erie	Fairview	N	N	Fairview School District																											
Erie	Fort Leboeuf	N	N	Fort Leboeuf School District																											
Erie	General Mclane	N	N	General Mclane School District																											
Erie	Girard	Y	N	Girard School District																											
Erie	Harbor Creek	N	N	Harbor Creek School District																											
Erie	Iroquois	N	N	Iroquois School District																											
Erie	Millcreek Township	N	N	Millcreek Township School District																											
Erie	Montessori Regional Cs	N	N	Montessori Regional Cs																											
Erie	North East	N	N	North East School District																											
Erie	Northwestern	Y	N	Northwestern School District																											
Erie	Perseus House Cs Of Excellence	N	N	Perseus House Cs Of Excellence																											
Erie	Robert Benjamin Wiley Community Cs	N	N	Robert Benjamin Wiley Community Cs																											
Erie	Union City Area	N	N	Union City Area School District																											
Erie	Wattsburg Area	N	N	Wattsburg Area School District																											
Fayette	Albert Gallatin Area	Y	N	Albert Gallatin Area School District																											
Fayette	Brownsville Area	Y	Y	Brownsville Area School District																											
Fayette	Connellsville Area	Y	N	Connellsville Area School District																											
Fayette	Connellsville Area Career & Technical Center	N	N	Connellsville Area Career & Technical Center																											
Fayette	Fayette County Career & Technical Institute	N	N	Fayette County Career & Technical Institute School District																											
Fayette	Frazier	N	N	Frazier School District																											
Fayette	Laurel Highlands	Y	N	Laurel Highlands School District																											
Fayette	Uniontown Area	Y	Y	Uniontown Area School District																											
Forest	Forest Area	N	Y	Forest Area School District																											
Franklin	Chambersburg Area	N	Y	Chambersburg Area School District																											
Franklin	Fannett-Metal	Y	N	Fannett-Metal School District																											
Franklin	Franklin County Career And Technical Center	N	N	Franklin County Career And Technical Center																											
Franklin	Greencastle-Antrim	N	N	Greencastle-Antrim School District																											
Franklin	Shippensburg Area	N	N	Shippensburg Area School District																											
Franklin	Tuscarora	N	N	Tuscarora School District																											
Franklin	Waynesboro Area	N	N	Waynesboro Area School District																											
Fulton	Central Fulton	N	N	Central Fulton School District																											
Fulton	Forbes Road	N	N	Forbes Road School District																											
Fulton	Fulton County Avts	N	N	Fulton County Avts School District																											
Fulton	Southern Fulton	N	N	Southern Fulton School District																											
Greene	Carmichaels Area	N	N	Carmichaels Area School District																											
Greene	Central Greene	N	N	Central Greene School District																											
Greene	Greene County Career And Technical Center	N	N	Greene County Career And Technical Center																											
Greene	Jefferson-Morgan	N	N	Jefferson-Morgan School District																											
Greene	Southeastern Greene	N	N	Southeastern Greene School District																											
Greene	West Greene	N	Y	West Greene School District																											
Huntingdon	Huntingdon Area	Y	N	Huntingdon Area School District																											
Huntingdon	Huntingdon County Career And Technical Center	N	N	Huntingdon County Career And Technical Center																											
Huntingdon	Juniata Valley	N	N	Juniata Valley School District																											
Huntingdon	Mount Union Area	Y	Y	Mount Union Area School District																											
Huntingdon	New Day Charter School	N	N	New Day Charter School																											
Huntingdon	Southern Huntingdon County	Y	Y	Southern Huntingdon County School District																											
Huntingdon	Stone Valley Community Cs	N	N	Stone Valley Community Cs																											
Indiana	Blairsville-Saltsburg	N	N	Blairsville-Saltsburg School District																											
Indiana	Homer-Center	N	N	Homer-Center School District																											
Indiana	Indiana Area	N	N	Indiana Area School District																											
Indiana	Indiana County Technology Center	N	N	Indiana County Technology Center																											
Indiana	Marion Center Area	N	N	Marion Center Area School District																											
Indiana	Penns Manor Area	N	Y	Penns Manor Area School District																											
Indiana	Purchase Line	N	Y	Purchase Line School District																											
Indiana	United	N	N	United School District																											
Jefferson	Brockway Area	N	N	Brockway Area School District																											
Jefferson	Brookville Area	N	N	Brookville Area School District																											
Jefferson	Jefferson County-Dubois Avts	N	N	Jefferson County-Dubois Avts School District																											
Jefferson	Punxsutawney Area	Y	N	Punxsutawney Area School District																											
Juniata	Juniata County	N	Y	Juniata County School District																											
Lackawanna	Abington Heights	N	N	Abington Heights School District																											
Lackawanna	Carbondale Area	Y	Y	Carbondale Area School District																											
Lackawanna	Career And Technical Center Of Lackawanna County	N	N	Career And Technical Center Of Lackawanna County																											
Lackawanna	Dunmore	N	Y	Dunmore School District																											
Lackawanna	Fell Cs	N	N	Fell Cs																											
Lackawanna	Howard Gardner Multiple Intelligence Cs	N	N	Howard Gardner Multiple Intelligence Cs																											
Lackawanna	Lakeland	N	N	Lakeland School District																											
Lackawanna	Mid Valley	Y	N	Mid Valley School District																											
Lackawanna	North Pocono	N	N	North Pocono School District																											
Lackawanna	Old Forge	N	N	Old Forge School District																											
Lackawanna	Riverside	N	N	Riverside School District																											
Lackawanna	Scranton	Y	Y	Scranton School District																											
Lackawanna	Valley View	N	N	Valley View School District																											
Lancaster	Cocalico	N	N	Cocalico School District																											
Lancaster	Columbia Borough	Y	Y	Columbia Borough School District																											
Lancaster	Conestoga Valley	N	N	Conestoga Valley School District																											
Lancaster	Donegal	N	N	Donegal School District																											
Lancaster	Eastern Lancaster County	N	N	Eastern Lancaster County School District																											
Lancaster	Elizabethtown Area	N	N	Elizabethtown Area School District																											
Lancaster	Ephrata Area	Y	N	Ephrata Area School District																											
Lancaster	Hempfield	N	N	Hempfield School District																											
Lancaster	La Academia Partnership Charter School	N	N	La Academia Partnership Charter School																											
Lancaster	Lampeter-Strasburg	N	N	Lampeter-Strasburg School District																											
Lancaster	Lancaster	Y	Y	Lancaster School District																											
Lancaster	Lancaster County Academy	N	N	Lancaster County Academy																											
Lancaster	Lancaster County Career And Technical Center	N	N	Lancaster County Career And Technical Center																											
Lancaster	Manheim Central	N	N	Manheim Central School District																											
Lancaster	Manheim Township	N	N	Manheim Township School District																											
Lancaster	Penn Manor	N	N	Penn Manor School District																											
Lancaster	Pequea Valley	N	N	Pequea Valley School District																											
Lancaster	Solanco	N	N	Solanco School District																											
Lancaster	Warwick	N	N	Warwick School District																											
Lawrence	Ellwood City Area	N	N	Ellwood City Area School District																											
Lawrence	Laurel	N	N	Laurel School District																											
Lawrence	Lawrence County Career And Technical Center	N	N	Lawrence County Career And Technical Center																											
Lawrence	Mohawk Area	N	N	Mohawk Area School District																											
Lawrence	Neshannock Township	N	N	Neshannock Township School District																											
Lawrence	New Castle Area	Y	Y	New Castle Area School District																											
Lawrence	Shenango Area	N	N	Shenango Area School District																											
Lawrence	Union Area	N	N	Union Area School District																											
Lawrence	Wilmington Area	N	N	Wilmington Area School District																											
Lebanon	Annville-Cleona	N	N	Annville-Cleona School District																											
Lebanon	Cornwall-Lebanon	N	N	Cornwall-Lebanon School District																											
Lebanon	Eastern Lebanon County	N	N	Eastern Lebanon County School District																											
Lebanon	Lebanon	Y	Y	Lebanon School District																											
Lebanon	Lebanon County Career And Technical Center	N	N	Lebanon County Career And Technical Center																											
Lebanon	Northern Lebanon	N	N	Northern Lebanon School District																											
Lebanon	Palmyra Area	N	N	Palmyra Area School District																											
Lehigh	Allentown City	Y	Y	Allentown City School District																											
Lehigh	Arts Academy Cs	N	N	Arts Academy Cs																											
Lehigh	Arts Academy Elementary Charter School	N	N	Arts Academy Elementary Charter School																											
Lehigh	Catasauqua Area	N	N	Catasauqua Area School District																											
Lehigh	Circle Of Seasons Charter School	N	N	Circle Of Seasons Charter School																											
Lehigh	East Penn	N	N	East Penn School District																											
Lehigh	Executive Education Academy Charter School	N	N	Executive Education Academy Charter School																											
Lehigh	Innovative Arts Academy Cs	N	N	Innovative Arts Academy Cs																											
Lehigh	Lehigh Career & Technical Institute	N	N	Lehigh Career & Technical Institute School District																											
Lehigh	Lincoln Leadership Academy Charter School	N	N	Lincoln Leadership Academy Charter School																											
Lehigh	Medical Academy Cs	N	N	Medical Academy Cs																											
Lehigh	Northern Lehigh	N	N	Northern Lehigh School District																											
Lehigh	Northwestern Lehigh	N	N	Northwestern Lehigh School District																											
Lehigh	Parkland	N	N	Parkland School District																											
Lehigh	Roberto Clemente Cs	N	N	Roberto Clemente Cs																											
Lehigh	ROBERTO CLEMENTE ELEMENTARY CHARTER SCHOOL	N	N	ROBERTO CLEMENTE ELEMENTARY CHARTER SCHOOL																											
Lehigh	Salisbury Township	N	N	Salisbury Township School District																											
Lehigh	Seven Generations Charter School	N	N	Seven Generations Charter School																											
Lehigh	Southern Lehigh	N	N	Southern Lehigh School District																											
Lehigh	Whitehall-Coplay	N	N	Whitehall-Coplay School District																											
Luzerne	Bear Creek Community Cs	N	N	Bear Creek Community Cs																											
Luzerne	Berwick Area	N	N	Berwick Area School District																											
Luzerne	Crestwood	N	N	Crestwood School District																											
Luzerne	Dallas	N	N	Dallas School District																											
Luzerne	Greater Nanticoke Area	Y	N	Greater Nanticoke Area School District																											
Luzerne	Hanover Area	Y	Y	Hanover Area School District																											
Luzerne	Hazleton Area	Y	Y	Hazleton Area School District																											
Luzerne	Hazleton Area Career Center	N	N	Hazleton Area Career Center																											
Luzerne	Lake-Lehman	N	N	Lake-Lehman School District																											
Luzerne	Northwest Area	Y	N	Northwest Area School District																											
Luzerne	Pittston Area	N	N	Pittston Area School District																											
Luzerne	West Side Career And Technical Center	N	N	West Side Career And Technical Center																											
Luzerne	Wilkes-Barre Area	Y	Y	Wilkes-Barre Area School District																											
Luzerne	Wilkes-Barre Area Career And Technical Center	N	N	Wilkes-Barre Area Career And Technical Center																											
Luzerne	Wyoming Area	Y	N	Wyoming Area School District																											
Luzerne	Wyoming Valley West	N	Y	Wyoming Valley West School District																											
Lycoming	East Lycoming	N	N	East Lycoming School District																											
Lycoming	Jersey Shore Area	N	N	Jersey Shore Area School District																											
Lycoming	Loyalsock Township	N	N	Loyalsock Township School District																											
Lycoming	Lycoming Career And Technical Center	N	N	Lycoming Career And Technical Center																											
Lycoming	Montgomery Area	N	N	Montgomery Area School District																											
Lycoming	Montoursville Area	N	N	Montoursville Area School District																											
Lycoming	Muncy	N	N	Muncy School District																											
Lycoming	South Williamsport Area	N	N	South Williamsport Area School District																											
Lycoming	Williamsport Area	Y	N	Williamsport Area School District																											
McKean	Bradford Area	N	N	Bradford Area School District																											
McKean	Kane Area	Y	N	Kane Area School District																											
McKean	Otto-Eldred	N	N	Otto-Eldred School District																											
McKean	Port Allegany	N	Y	Port Allegany School District																											
McKean	Seneca Highlands Career And Technical Center	N	N	Seneca Highlands Career And Technical Center																											
McKean	Smethport Area	N	N	Smethport Area School District																											
Mercer	Commodore Perry	N	N	Commodore Perry School District																											
Mercer	Farrell Area	Y	Y	Farrell Area School District																											
Mercer	Greenville Area	Y	N	Greenville Area School District																											
Mercer	Grove City Area	N	N	Grove City Area School District																											
Mercer	Hermitage	N	N	Hermitage School District																											
Mercer	Jamestown Area	N	N	Jamestown Area School District																											
Mercer	Keystone Education Center Cs	N	N	Keystone Education Center Cs																											
Mercer	Lakeview	N	N	Lakeview School District																											
Mercer	Mercer Area	Y	N	Mercer Area School District																											
Mercer	Mercer County Career Center	N	N	Mercer County Career Center																											
Mercer	Reynolds	N	N	Reynolds School District																											
Mercer	Sharon City	Y	Y	Sharon City School District																											
Mercer	Sharpsville Area	N	N	Sharpsville Area School District																											
Mercer	West Middlesex Area	N	N	West Middlesex Area School District																											
Mifflin	Mifflin County	N	N	Mifflin County School District																											
Mifflin	Mifflin County Academy Of Science And Technology	N	N	Mifflin County Academy Of Science And Technology																											
Monroe	East Stroudsburg Area	N	N	East Stroudsburg Area School District																											
Monroe	Evergreen Community Cs	N	N	Evergreen Community Cs																											
Monroe	Monroe Career & Technical Institute	N	N	Monroe Career & Technical Institute																											
Monroe	Pleasant Valley	N	N	Pleasant Valley School District																											
Monroe	Pocono Mountain	N	Y	Pocono Mountain School District																											
Monroe	Stroudsburg Area	N	N	Stroudsburg Area School District																											
Montgomery	Abington	N	N	Abington School District																											
Montgomery	Agora Cyber Cs	N	N	Agora Cyber Cs																											
Montgomery	Central Montco Technical High School	N	N	Central Montco Technical High School																											
Montgomery	Cheltenham Township	N	N	Cheltenham Township School District																											
Montgomery	Colonial	N	N	Colonial School District																											
Montgomery	Eastern Center For Arts & Technology	N	N	Eastern Center For Arts & Technology																											
Montgomery	Hatboro-Horsham	N	N	Hatboro-Horsham School District																											
Montgomery	Jenkintown	N	N	Jenkintown School District																											
Montgomery	Lower Merion	N	N	Lower Merion School District																											
Montgomery	Lower Moreland Township	N	N	Lower Moreland Township School District																											
Montgomery	Methacton	N	N	Methacton School District																											
Montgomery	Norristown Area	Y	Y	Norristown Area School District																											
Montgomery	North Montco Technical Career Center	N	N	North Montco Technical Career Center																											
Montgomery	North Penn	N	N	North Penn School District																											
Montgomery	Pennsylvania Virtual Charter School	N	N	Pennsylvania Virtual Charter School																											
Montgomery	Perkiomen Valley	N	N	Perkiomen Valley School District																											
Montgomery	Pottsgrove	N	N	Pottsgrove School District																											
Montgomery	Pottstown	Y	Y	Pottstown School District																											
Montgomery	Souderton Area	N	N	Souderton Area School District																											
Montgomery	Souderton Cs Collaborative	N	N	Souderton Cs Collaborative																											
Montgomery	Spring-Ford Area	N	N	Spring-Ford Area School District																											
Montgomery	Springfield Township	N	N	Springfield Township School District																											
Montgomery	Upper Dublin	N	N	Upper Dublin School District																											
Montgomery	Upper Merion Area	N	N	Upper Merion Area School District																											
Montgomery	Upper Moreland Township	N	N	Upper Moreland Township School District																											
Montgomery	Upper Perkiomen	N	N	Upper Perkiomen School District																											
Montgomery	Western Montgomery Career And Technical Center	N	N	Western Montgomery Career And Technical Center																											
Montgomery	Wissahickon	N	N	Wissahickon School District																											
Montour	Danville Area	N	N	Danville Area School District																											
Montour	Danville Ctr Adolescent Female	N	N	Danville Ctr Adolescent Female																											
Montour	North Central Secure Trmnt Unt	N	N	North Central Secure Trmnt Unt																											
Northampton	Bangor Area	N	N	Bangor Area School District																											
Northampton	Bethlehem Area	Y	Y	Bethlehem Area School District																											
Northampton	Bethlehem Avts	N	N	Bethlehem Avts School District																											
Northampton	Career Institute Of Technology	N	N	Career Institute Of Technology School District																											
Northampton	Easton Area	N	Y	Easton Area School District																											
Northampton	Easton Arts Academy Elementary Charter School	N	N	Easton Arts Academy Elementary Charter School																											
Northampton	Lehigh Valley Academy Regional Cs	N	N	Lehigh Valley Academy Regional Cs																											
Northampton	Lehigh Valley Charter High School For The Arts	N	N	Lehigh Valley Charter High School For The Arts																											
Northampton	Lehigh Valley Dual Language Charter School	N	N	Lehigh Valley Dual Language Charter School																											
Northampton	Nazareth Area	N	N	Nazareth Area School District																											
Northampton	Northampton Area	N	N	Northampton Area School District																											
Northampton	Pen Argyl Area	N	N	Pen Argyl Area School District																											
Northampton	Saucon Valley	N	N	Saucon Valley School District																											
Northampton	Wilson Area	N	N	Wilson Area School District																											
Northumberland	Line Mountain	N	N	Line Mountain School District																											
Northumberland	Milton Area	N	N	Milton Area School District																											
Northumberland	Mount Carmel Area	Y	N	Mount Carmel Area School District																											
Northumberland	Northumberland County Career And Technical Center	N	N	Northumberland County Career And Technical Center																											
Northumberland	Shamokin Area	Y	N	Shamokin Area School District																											
Northumberland	Shikellamy	N	N	Shikellamy School District																											
Northumberland	Warrior Run	N	N	Warrior Run School District																											
Perry	Greenwood	N	N	Greenwood School District																											
Perry	Newport	N	N	Newport School District																											
Perry	Susquenita	N	N	Susquenita School District																											
Perry	West Perry	N	N	West Perry School District																											
Philadelphia	Ad Prima Cs	N	N	Ad Prima Cs																											
Philadelphia	Alliance For Progress Cs	N	N	Alliance For Progress Cs																											
Philadelphia	Antonia Pantoja Community Charter School	N	N	Antonia Pantoja Community Charter School																											
Philadelphia	Arise Academy Charter High School	N	N	Arise Academy Charter High School																											
Philadelphia	Aspira Bilingual Cyber Charter School	N	N	Aspira Bilingual Cyber Charter School																											
Philadelphia	Belmont Charter School	N	N	Belmont Charter School																											
Philadelphia	Birney Preparatory Academy	N	N	Birney Preparatory Academy																											
Philadelphia	Boys Latin Of Philadelphia Cs	N	N	Boys Latin Of Philadelphia Cs																											
Philadelphia	Christopher Columbus Cs	N	N	Christopher Columbus Cs																											
Philadelphia	Community Academy Of Philadelphia Cs	N	N	Community Academy Of Philadelphia Cs																											
Philadelphia	Deep Roots Charter School	N	N	Deep Roots Charter School																											
Philadelphia	Delaware Valley Chs	N	N	Delaware Valley Chs																											
Philadelphia	Discovery Charter School	N	N	Discovery Charter School																											
Philadelphia	Esperanza Academy Charter High School	N	N	Esperanza Academy Charter High School																											
Philadelphia	Esperanza Cyber Cs	N	N	Esperanza Cyber Cs																											
Philadelphia	Eugenio Maria De Hostos Cs	N	N	Eugenio Maria De Hostos Cs																											
Philadelphia	First Philadelphia Preparatory Charter School	N	N	First Philadelphia Preparatory Charter School																											
Philadelphia	Folk Arts-Cultural Treasures Cs	N	N	Folk Arts-Cultural Treasures Cs																											
