Philadelphia	Franklin Towne Charter Elementary School	N	N	Franklin Towne Charter Elementary School																											
Philadelphia	Franklin Towne Chs	N	N	Franklin Towne Chs																											
Philadelphia	Freire Cs	N	N	Freire Cs																											
Philadelphia	Global Leadership Academy Cs	N	N	Global Leadership Academy Cs																											
Philadelphia	Global Leadership Academy Cs Southwest At Huey	N	N	Global Leadership Academy Cs Southwest At Huey																											
Philadelphia	Green Woods Cs	N	N	Green Woods Cs																											
Philadelphia	Hardy Williams Academy Cs	N	N	Hardy Williams Academy Cs																											
Philadelphia	Imani Education Circle Cs	N	N	Imani Education Circle Cs																											
Philadelphia	Imhotep Institute Chs	N	N	Imhotep Institute Chs																											
Philadelphia	Independence Charter School	N	N	Independence Charter School																											
Philadelphia	Independence Cs West	N	N	Independence Cs West																											
Philadelphia	Inquiry Charter School	N	N	Inquiry Charter School																											
Philadelphia	John B Stetson Charter School	N	N	John B Stetson Charter School																											
Philadelphia	Khepera Cs	N	N	Khepera Cs																											
Philadelphia	KIPP DuBois Charter School	N	N	KIPP DuBois Charter School																											
Philadelphia	KIPP North Philadelphia Charter School	N	N	KIPP North Philadelphia Charter School																											
Philadelphia	KIPP Philadelphia Charter School	N	N	KIPP Philadelphia Charter School																											
Philadelphia	KIPP West Philadelphia Cs	N	N	KIPP West Philadelphia Cs																											
Philadelphia	Laboratory Cs	N	N	Laboratory Cs																											
Philadelphia	Mariana Bracetti Academy Cs	N	N	Mariana Bracetti Academy Cs																											
Philadelphia	Maritime Academy Charter School	N	N	Maritime Academy Charter School																											
Philadelphia	Mast Community Charter School	N	N	Mast Community Charter School																											
Philadelphia	Mast Community Cs Ii	N	N	Mast Community Cs Ii																											
Philadelphia	Mastery Charter High School	N	N	Mastery Charter High School																											
Philadelphia	Mastery Cs - Cleveland Elementary	N	N	Mastery Cs - Cleveland Elementary																											
Philadelphia	Mastery Cs - Francis D. Pastorius Elementary	N	N	Mastery Cs - Francis D. Pastorius Elementary																											
Philadelphia	Mastery Cs John Wister Elementary	N	N	Mastery Cs John Wister Elementary																											
Philadelphia	Mastery Cs-Clymer Elementary	N	N	Mastery Cs-Clymer Elementary																											
Philadelphia	Mastery Cs-Gratz Campus	N	N	Mastery Cs-Gratz Campus																											
Philadelphia	Mastery Cs-Harrity Campus	N	N	Mastery Cs-Harrity Campus																											
Philadelphia	Mastery Cs-Mann Campus	N	N	Mastery Cs-Mann Campus																											
Philadelphia	Mastery Cs-Pickett Campus	N	N	Mastery Cs-Pickett Campus																											
Philadelphia	Mastery Cs-Shoemaker Campus	N	N	Mastery Cs-Shoemaker Campus																											
Philadelphia	Mastery Cs-Smedley Campus	N	N	Mastery Cs-Smedley Campus																											
Philadelphia	Mastery Cs-Thomas Campus	N	N	Mastery Cs-Thomas Campus																											
Philadelphia	Mastery Prep Elementary Charter School	N	N	Mastery Prep Elementary Charter School																											
Philadelphia	Math Civics And Sciences Cs	N	N	Math Civics And Sciences Cs																											
Philadelphia	Memphis Street Academy Cs @ Jp Jones	N	N	Memphis Street Academy Cs @ Jp Jones																											
Philadelphia	Multi-Cultural Academy Cs	N	N	Multi-Cultural Academy Cs																											
Philadelphia	New Foundations Cs	N	N	New Foundations Cs																											
Philadelphia	New Media Technology Cs	N	N	New Media Technology Cs																											
Philadelphia	Northwood Academy Cs	N	N	Northwood Academy Cs																											
Philadelphia	Olney Charter High School	N	N	Olney Charter High School																											
Philadelphia	Pan American Academy Cs	N	N	Pan American Academy Cs																											
Philadelphia	People For People Cs	N	N	People For People Cs																											
Philadelphia	Philadelphia Academy Cs	N	N	Philadelphia Academy Cs																											
Philadelphia	Philadelphia City	Y	Y	Philadelphia City School District																											
Philadelphia	Philadelphia Electrical & Technical Chs	N	N	Philadelphia Electrical & Technical Chs																											
Philadelphia	Philadelphia Harambee Institute Cs	N	N	Philadelphia Harambee Institute Cs																											
Philadelphia	Philadelphia Montessori Cs	N	N	Philadelphia Montessori Cs																											
Philadelphia	Philadelphia Performing Arts Cs	N	N	Philadelphia Performing Arts Cs																											
Philadelphia	Planet Abacus Cs	N	N	Planet Abacus Cs																											
Philadelphia	Preparatory Cs Of Mathematics Science Technical And Careers	N	N	Preparatory Cs Of Mathematics Science Technical And Careers																											
Philadelphia	Renaissance Charter School	N	N	Renaissance Charter School																											
Philadelphia	Richard Allen Preparatory Cs	N	N	Richard Allen Preparatory Cs																											
Philadelphia	Russell Byers Cs	N	N	Russell Byers Cs																											
Philadelphia	Sankofa Freedom Academy Charter School	N	N	Sankofa Freedom Academy Charter School																											
Philadelphia	Southwest Leadership Academy Cs	N	N	Southwest Leadership Academy Cs																											
Philadelphia	Tacony Academy Charter School	N	N	Tacony Academy Charter School																											
Philadelphia	Technical Freire Cs	N	N	Technical Freire Cs																											
Philadelphia	The Philadelphia Cs For Arts And Sciences At Hr Edmunds	N	N	The Philadelphia Cs For Arts And Sciences At Hr Edmunds																											
Philadelphia	Truebright Science Academy Cs	N	N	Truebright Science Academy Cs																											
Philadelphia	Universal Alcorn Cs	N	N	Universal Alcorn Cs																											
Philadelphia	Universal Audenried Charter School	N	N	Universal Audenried Charter School																											
Philadelphia	Universal Bluford Charter School	N	N	Universal Bluford Charter School																											
Philadelphia	Universal Creighton Charter School	N	N	Universal Creighton Charter School																											
Philadelphia	Universal Daroff Charter School	N	N	Universal Daroff Charter School																											
Philadelphia	Universal Institute Cs	N	N	Universal Institute Cs																											
Philadelphia	Universal Vare Charter School	N	N	Universal Vare Charter School																											
Philadelphia	Wakisha Cs	N	N	Wakisha Cs																											
Philadelphia	Walter D Palmer Leadership Learning Partners Cs	N	N	Walter D Palmer Leadership Learning Partners Cs																											
Philadelphia	West Oak Lane Cs	N	N	West Oak Lane Cs																											
Philadelphia	West Phila. Achievement Ces	N	N	West Phila. Achievement Ces																											
Philadelphia	Wissahickon Cs	N	N	Wissahickon Cs																											
Philadelphia	World Communications Cs	N	N	World Communications Cs																											
Philadelphia	Young Scholars Cs	N	N	Young Scholars Cs																											
Philadelphia	Young Scholars Frederick Douglas Charter School	N	N	Young Scholars Frederick Douglas Charter School																											
Philadelphia	Young Scholars Kenderton Cs	N	N	Young Scholars Kenderton Cs																											
Philadelphia	Youth Build Phila Cs	N	N	Youth Build Phila Cs																											
Pike	Delaware Valley	N	N	Delaware Valley School District																											
Pike	Wallenpaupack Area	N	N	Wallenpaupack Area School District																											
Potter	Austin Area	N	N	Austin Area School District																											
Potter	Coudersport Area	N	N	Coudersport Area School District																											
Potter	Galeton Area	N	N	Galeton Area School District																											
Potter	Northern Potter	N	N	Northern Potter School District																											
Potter	Oswayo Valley	N	N	Oswayo Valley School District																											
Schuylkill	Blue Mountain	N	N	Blue Mountain School District																											
Schuylkill	Gillingham Charter School	N	N	Gillingham Charter School																											
Schuylkill	Mahanoy Area	Y	Y	Mahanoy Area School District																											
Schuylkill	Minersville Area	Y	Y	Minersville Area School District																											
Schuylkill	North Schuylkill	Y	N	North Schuylkill School District																											
Schuylkill	Pine Grove Area	N	N	Pine Grove Area School District																											
Schuylkill	Pottsville Area	Y	N	Pottsville Area School District																											
Schuylkill	Saint Clair Area	Y	N	Saint Clair Area School District																											
Schuylkill	Schuylkill Haven Area	N	N	Schuylkill Haven Area School District																											
Schuylkill	Schuylkill Technology Centers	N	N	Schuylkill Technology Centers																											
Schuylkill	Shenandoah Valley	Y	Y	Shenandoah Valley School District																											
Schuylkill	Tamaqua Area	Y	N	Tamaqua Area School District																											
Schuylkill	Tri-Valley	N	Y	Tri-Valley School District																											
Schuylkill	Willams Valley	N	Y																												
Snyder	Midd-West	N	N	Midd-West School District																											
Snyder	Selinsgrove Area	N	N	Selinsgrove Area School District																											
Somerset	Berlin Brothersvalley	N	N	Berlin Brothersvalley School District																											
Somerset	Conemaugh Township Area	N	N	Conemaugh Township Area School District																											
Somerset	Meyersdale Area	N	N	Meyersdale Area School District																											
Somerset	North Star	N	N	North Star School District																											
Somerset	Rockwood Area	N	N	Rockwood Area School District																											
Somerset	Salisbury-Elk Lick	N	Y	Salisbury-Elk Lick School District																											
Somerset	Shade-Central City	N	N	Shade-Central City School District																											
Somerset	Shanksville-Stonycreek	N	N	Shanksville-Stonycreek School District																											
Somerset	Somerset Area	N	N	Somerset Area School District																											
Somerset	Somerset County Technology Center	N	N	Somerset County Technology Center																											
Somerset	Turkeyfoot Valley Area	N	Y	Turkeyfoot Valley Area School District																											
Somerset	Windber Area	N	N	Windber Area School District																											
Sullivan	Sullivan County	N	N	Sullivan County School District																											
Susquehanna	Blue Ridge	N	N	Blue Ridge School District																											
Susquehanna	Elk Lake	N	N	Elk Lake School District																											
Susquehanna	Forest City Regional	N	N	Forest City Regional School District																											
Susquehanna	Montrose Area	N	N	Montrose Area School District																											
Susquehanna	Mountain View	N	N	Mountain View School District																											
Susquehanna	Susquehanna Community	N	N	Susquehanna Community School District																											
Susquehanna	Susquehanna County Career And Technical Center	N	N	Susquehanna County Career And Technical Center																											
Tioga	Northern Tioga	N	N	Northern Tioga School District																											
Tioga	Southern Tioga	N	N	Southern Tioga School District																											
Tioga	Wellsboro Area	N	N	Wellsboro Area School District																											
Union	Lewisburg Area	N	N	Lewisburg Area School District																											
Union	Mifflinburg Area	N	N	Mifflinburg Area School District																											
Union	Sun Area Technical Institute	N	N	Sun Area Technical Institute School District																											
Venango	Cranberry Area	N	N	Cranberry Area School District																											
Venango	Franklin Area	Y	Y	Franklin Area School District																											
Venango	Oil City Area	Y	N	Oil City Area School District																											
Venango	Valley Grove	N	N	Valley Grove School District																											
Venango	Venango Technology Center	N	N	Venango Technology Center																											
Warren	Tidioute Community Cs	N	N	Tidioute Community Cs																											
Warren	Warren County	N	Y	Warren County School District																											
Warren	Warren County Avts	N	N	Warren County Avts School District																											
Washington	Avella Area	N	N	Avella Area School District																											
Washington	Bentworth	N	N	Bentworth School District																											
Washington	Bethlehem-Center	N	N	Bethlehem-Center School District																											
Washington	Burgettstown Area	N	N	Burgettstown Area School District																											
Washington	California Area	N	N	California Area School District																											
Washington	Canon-Mcmillan	N	N	Canon-Mcmillan School District																											
Washington	Charleroi	Y	N	Charleroi School District																											
Washington	Chartiers-Houston	N	N	Chartiers-Houston School District																											
Washington	Fort Cherry	N	N	Fort Cherry School District																											
Washington	Mcguffey	N	N	Mcguffey School District																											
Washington	Mon Valley Career And Technical Center	N	N	Mon Valley Career And Technical Center																											
Washington	Peters Township	N	N	Peters Township School District																											
Washington	Ringgold	Y	N	Ringgold School District																											
Washington	Trinity Area	N	N	Trinity Area School District																											
Washington	Washington	Y	N	Washington School District																											
Washington	Western Area Career And Technical Center	N	N	Western Area Career And Technical Center																											
Wayne	Wayne Highlands	N	N	Wayne Highlands School District																											
Wayne	Western Wayne	N	N	Western Wayne School District																											
Westmoreland	Belle Vernon Area	N	N	Belle Vernon Area School District																											
Westmoreland	Burrell	N	N	Burrell School District																											
Westmoreland	Central Westmoreland Career And Technical Center	N	N	Central Westmoreland Career And Technical Center																											
Westmoreland	Derry Area	N	N	Derry Area School District																											
Westmoreland	Dr Robert Ketterer Cs Inc.	N	N	Dr Robert Ketterer Cs Inc.																											
Westmoreland	Eastern Westmoreland Career And Technical Center	N	N	Eastern Westmoreland Career And Technical Center																											
Westmoreland	Franklin Regional	N	N	Franklin Regional School District																											
Westmoreland	Greater Latrobe	N	N	Greater Latrobe School District																											
Westmoreland	Greensburg Salem	Y	N	Greensburg Salem School District																											
Westmoreland	Hempfield Area	N	N	Hempfield Area School District																											
Westmoreland	Jeannette City	Y	N	Jeannette City School District																											
Westmoreland	Kiski Area	N	N	Kiski Area School District																											
Westmoreland	Ligonier Valley	N	N	Ligonier Valley School District																											
Westmoreland	Monessen City	Y	Y	Monessen City School District																											
Westmoreland	Mount Pleasant Area	N	N	Mount Pleasant Area School District																											
Westmoreland	New Kensington-Arnold	Y	Y	New Kensington-Arnold School District																											
Westmoreland	Northern Westmoreland Career And Technical Center	N	N	Northern Westmoreland Career And Technical Center																											
Westmoreland	Norwin	N	N	Norwin School District																											
Westmoreland	Penn-Trafford	N	N	Penn-Trafford School District																											
Westmoreland	Southmoreland	N	N	Southmoreland School District																											
Westmoreland	Yough	N	N	Yough School District																											
Wyoming	Lackawanna Trail	N	N	Lackawanna Trail School District																											
Wyoming	Tunkhannock Area	N	N	Tunkhannock Area School District																											
York	Central York	N	N	Central York School District																											
York	Crispus Attucks Youthbuild Cs	N	N	Crispus Attucks Youthbuild Cs																											
York	Dallastown Area	N	N	Dallastown Area School District																											
York	Dover Area	N	N	Dover Area School District																											
York	Eastern York	N	N	Eastern York School District																											
York	Hanover Public	N	N	Hanover Public School District																											
York	Helen Thackston Charter School	N	N	Helen Thackston Charter School																											
York	Lincoln Cs	N	N	Lincoln Cs																											
York	Northeastern York	N	N	Northeastern York School District																											
York	Northern York County	N	N	Northern York County School District																											
York	Red Lion Area	N	N	Red Lion Area School District																											
York	South Eastern	N	N	South Eastern School District																											
York	South Western	N	N	South Western School District																											
York	Southern York County	N	N	Southern York County School District																											
York	Spring Grove Area	N	N	Spring Grove Area School District																											
York	West Shore	N	N	West Shore School District																											
York	West York Area	N	N	West York Area School District																											
York	York Academy Regional Charter School	N	N	York Academy Regional Charter School																											
York	York City	Y	Y	York City School District																											
York	York County School Of Technology	N	N	York County School Of Technology																											
York	York Suburban	N	N	York Suburban School District																											